{
  "$schema": "https://agentj.app/schema/agentj-card-1.json",
  "schemaVersion": 1,
  "id": "calendar",
  "version": "1.0.0",
  "name": {
    "zh": "日历",
    "en": "Calendar"
  },
  "description": {
    "zh": "与 Agent J 共同管理日程",
    "en": "Manage your schedule with Agent J"
  },
  "author": "Agent J",
  "icon": "calendar",
  "accent": "windstorm",
  "template": "checklist",
  "plus": "agentj-calendar",
  "data": {
    "file": "calendar.json",
    "maxBytes": 262144
  },
  "actions": []
}
