{
  "$schema": "https://agentj.app/schema/agentj-card-1.json",
  "schemaVersion": 1,
  "id": "official-palette",
  "version": "1.0.0",
  "name": {
    "zh": "配色板",
    "en": "Palette"
  },
  "description": {
    "zh": "从一个颜色生成配色，存到我的配色，供各张卡片选用。",
    "en": "Generate related colors and save palettes to use across your cards."
  },
  "author": "Agent J",
  "icon": "board",
  "accent": "magic-carpet",
  "template": "notes",
  "plus": "agentj-cards",
  "data": {
    "file": "palette.md"
  },
  "actions": []
}
